{
 "schema": "rtm-roundmanifest-1.0",
 "tool_version": "0.3.1",
 "program": "L2MN-DEMO",
 "country": "MN",
 "round": 1,
 "generated_by": "L01",
 "generated_at": "2026-06-26T16:05:00+08:00",
 "synthetic": true,
 "rule": {
  "name": "random",
  "seed": 20261027
 },
 "replacement_policy": {
  "active": true,
  "triggers": [
   "REFUSAL_HARD",
   "ALL_NUMBERS_DEAD"
  ]
 },
 "calendar": {
  "window_start": "2026-06-29",
  "window_end": "2026-07-22",
  "working_weekdays": [
   1,
   2,
   3,
   4,
   5,
   6
  ],
  "call_hours": {
   "start": 9,
   "end": 21
  },
  "time_zone": "Asia/Ulaanbaatar",
  "holidays": [
   {
    "date": "2026-07-10",
    "name": "National Festival and People's Revolution Anniversary",
    "estimated": false,
    "working": false
   },
   {
    "date": "2026-07-11",
    "name": "National Festival and People's Revolution Anniversary",
    "estimated": false,
    "working": false
   },
   {
    "date": "2026-07-12",
    "name": "National Festival and People's Revolution Anniversary",
    "estimated": false,
    "working": false
   },
   {
    "date": "2026-07-13",
    "name": "National Festival and People's Revolution Anniversary",
    "estimated": false,
    "working": false
   },
   {
    "date": "2026-07-14",
    "name": "National Festival and People's Revolution Anniversary",
    "estimated": false,
    "working": false
   },
   {
    "date": "2026-07-15",
    "name": "National Festival and People's Revolution Anniversary",
    "estimated": false,
    "working": false
   }
  ],
  "dial_cap": 8,
  "day_list": 6
 },
 "away": [],
 "enumerators": [
  {
   "enumerator_id": "E01",
   "available": true,
   "share": 0.25,
   "households": 27,
   "platform_id": "CATI01",
   "file": "E01_assignment_R01.json",
   "fingerprint": "2c6b8d7fb76aa0e493218d7f91a83d41a7e3b4dc51de69a87db3bd4fcdd3760f"
  },
  {
   "enumerator_id": "E02",
   "available": true,
   "share": 0.25,
   "households": 27,
   "platform_id": "CATI02",
   "file": "E02_assignment_R01.json",
   "fingerprint": "aaa21d6bd582cf68ae9581daa48d31ac8c3ae4009352997093b926f64a05c357"
  },
  {
   "enumerator_id": "E03",
   "available": true,
   "share": 0.25,
   "households": 27,
   "platform_id": "CATI03",
   "file": "E03_assignment_R01.json",
   "fingerprint": "540ff7b33ed6cc2a9258f902099644fb93cb04ff40fb8d923f4942a47da5d14e"
  },
  {
   "enumerator_id": "E07",
   "available": true,
   "share": 0.25,
   "households": 27,
   "platform_id": "CATI07",
   "file": "E07_assignment_R01.json",
   "fingerprint": "e4b8b4f0cf455655033872587545b4e169ed616935f150ec2e69a7c9449ef7da"
  }
 ],
 "households": [
  {
   "hhid": "0101-001",
   "enumerator_id": "E07",
   "reason": "new",
   "psu": "0101",
   "stratum": "1",
   "replacements": [
    "0101-101"
   ]
  },
  {
   "hhid": "0101-002",
   "enumerator_id": "E01",
   "reason": "new",
   "psu": "0101",
   "stratum": "1",
   "replacements": [
    "0101-102"
   ]
  },
  {
   "hhid": "0101-003",
   "enumerator_id": "E03",
   "reason": "new",
   "psu": "0101",
   "stratum": "1",
   "replacements": [
    "0101-103"
   ]
  },
  {
   "hhid": "0101-004",
   "enumerator_id": "E01",
   "reason": "new",
   "psu": "0101",
   "stratum": "1"
  },
  {
   "hhid": "0101-005",
   "enumerator_id": "E01",
   "reason": "new",
   "psu": "0101",
   "stratum": "1"
  },
  {
   "hhid": "0101-006",
   "enumerator_id": "E02",
   "reason": "new",
   "psu": "0101",
   "stratum": "1"
  },
  {
   "hhid": "0101-007",
   "enumerator_id": "E01",
   "reason": "new",
   "psu": "0101",
   "stratum": "1"
  },
  {
   "hhid": "0101-008",
   "enumerator_id": "E07",
   "reason": "new",
   "psu": "0101",
   "stratum": "1"
  },
  {
   "hhid": "0101-009",
   "enumerator_id": "E01",
   "reason": "new",
   "psu": "0101",
   "stratum": "1"
  },
  {
   "hhid": "0102-001",
   "enumerator_id": "E02",
   "reason": "new",
   "psu": "0102",
   "stratum": "1",
   "replacements": [
    "0102-101"
   ]
  },
  {
   "hhid": "0102-002",
   "enumerator_id": "E03",
   "reason": "new",
   "psu": "0102",
   "stratum": "1",
   "replacements": [
    "0102-102"
   ]
  },
  {
   "hhid": "0102-003",
   "enumerator_id": "E03",
   "reason": "new",
   "psu": "0102",
   "stratum": "1",
   "replacements": [
    "0102-103"
   ]
  },
  {
   "hhid": "0102-004",
   "enumerator_id": "E07",
   "reason": "new",
   "psu": "0102",
   "stratum": "1"
  },
  {
   "hhid": "0102-005",
   "enumerator_id": "E02",
   "reason": "new",
   "psu": "0102",
   "stratum": "1"
  },
  {
   "hhid": "0102-006",
   "enumerator_id": "E02",
   "reason": "new",
   "psu": "0102",
   "stratum": "1"
  },
  {
   "hhid": "0102-007",
   "enumerator_id": "E03",
   "reason": "new",
   "psu": "0102",
   "stratum": "1"
  },
  {
   "hhid": "0102-008",
   "enumerator_id": "E02",
   "reason": "new",
   "psu": "0102",
   "stratum": "1"
  },
  {
   "hhid": "0102-009",
   "enumerator_id": "E07",
   "reason": "new",
   "psu": "0102",
   "stratum": "1"
  },
  {
   "hhid": "0103-001",
   "enumerator_id": "E01",
   "reason": "new",
   "psu": "0103",
   "stratum": "1",
   "replacements": [
    "0103-101"
   ]
  },
  {
   "hhid": "0103-002",
   "enumerator_id": "E07",
   "reason": "new",
   "psu": "0103",
   "stratum": "1",
   "replacements": [
    "0103-102"
   ]
  },
  {
   "hhid": "0103-003",
   "enumerator_id": "E01",
   "reason": "new",
   "psu": "0103",
   "stratum": "1",
   "replacements": [
    "0103-103"
   ]
  },
  {
   "hhid": "0103-004",
   "enumerator_id": "E03",
   "reason": "new",
   "psu": "0103",
   "stratum": "1"
  },
  {
   "hhid": "0103-005",
   "enumerator_id": "E02",
   "reason": "new",
   "psu": "0103",
   "stratum": "1"
  },
  {
   "hhid": "0103-006",
   "enumerator_id": "E03",
   "reason": "new",
   "psu": "0103",
   "stratum": "1"
  },
  {
   "hhid": "0103-007",
   "enumerator_id": "E03",
   "reason": "new",
   "psu": "0103",
   "stratum": "1"
  },
  {
   "hhid": "0103-008",
   "enumerator_id": "E01",
   "reason": "new",
   "psu": "0103",
   "stratum": "1"
  },
  {
   "hhid": "0103-009",
   "enumerator_id": "E01",
   "reason": "new",
   "psu": "0103",
   "stratum": "1"
  },
  {
   "hhid": "0104-001",
   "enumerator_id": "E02",
   "reason": "new",
   "psu": "0104",
   "stratum": "1",
   "replacements": [
    "0104-101"
   ]
  },
  {
   "hhid": "0104-002",
   "enumerator_id": "E02",
   "reason": "new",
   "psu": "0104",
   "stratum": "1",
   "replacements": [
    "0104-102"
   ]
  },
  {
   "hhid": "0104-003",
   "enumerator_id": "E01",
   "reason": "new",
   "psu": "0104",
   "stratum": "1",
   "replacements": [
    "0104-103"
   ]
  },
  {
   "hhid": "0104-004",
   "enumerator_id": "E03",
   "reason": "new",
   "psu": "0104",
   "stratum": "1"
  },
  {
   "hhid": "0104-005",
   "enumerator_id": "E07",
   "reason": "new",
   "psu": "0104",
   "stratum": "1"
  },
  {
   "hhid": "0104-006",
   "enumerator_id": "E07",
   "reason": "new",
   "psu": "0104",
   "stratum": "1"
  },
  {
   "hhid": "0104-007",
   "enumerator_id": "E02",
   "reason": "new",
   "psu": "0104",
   "stratum": "1"
  },
  {
   "hhid": "0104-008",
   "enumerator_id": "E07",
   "reason": "new",
   "psu": "0104",
   "stratum": "1"
  },
  {
   "hhid": "0104-009",
   "enumerator_id": "E07",
   "reason": "new",
   "psu": "0104",
   "stratum": "1"
  },
  {
   "hhid": "0105-001",
   "enumerator_id": "E07",
   "reason": "new",
   "psu": "0105",
   "stratum": "1",
   "replacements": [
    "0105-101"
   ]
  },
  {
   "hhid": "0105-002",
   "enumerator_id": "E07",
   "reason": "new",
   "psu": "0105",
   "stratum": "1",
   "replacements": [
    "0105-102"
   ]
  },
  {
   "hhid": "0105-003",
   "enumerator_id": "E01",
   "reason": "new",
   "psu": "0105",
   "stratum": "1",
   "replacements": [
    "0105-103"
   ]
  },
  {
   "hhid": "0105-004",
   "enumerator_id": "E03",
   "reason": "new",
   "psu": "0105",
   "stratum": "1"
  },
  {
   "hhid": "0105-005",
   "enumerator_id": "E02",
   "reason": "new",
   "psu": "0105",
   "stratum": "1"
  },
  {
   "hhid": "0105-006",
   "enumerator_id": "E02",
   "reason": "new",
   "psu": "0105",
   "stratum": "1"
  },
  {
   "hhid": "0105-007",
   "enumerator_id": "E07",
   "reason": "new",
   "psu": "0105",
   "stratum": "1"
  },
  {
   "hhid": "0105-008",
   "enumerator_id": "E03",
   "reason": "new",
   "psu": "0105",
   "stratum": "1"
  },
  {
   "hhid": "0105-009",
   "enumerator_id": "E01",
   "reason": "new",
   "psu": "0105",
   "stratum": "1"
  },
  {
   "hhid": "0106-001",
   "enumerator_id": "E03",
   "reason": "new",
   "psu": "0106",
   "stratum": "1",
   "replacements": [
    "0106-101"
   ]
  },
  {
   "hhid": "0106-002",
   "enumerator_id": "E03",
   "reason": "new",
   "psu": "0106",
   "stratum": "1",
   "replacements": [
    "0106-102"
   ]
  },
  {
   "hhid": "0106-003",
   "enumerator_id": "E02",
   "reason": "new",
   "psu": "0106",
   "stratum": "1",
   "replacements": [
    "0106-103"
   ]
  },
  {
   "hhid": "0106-004",
   "enumerator_id": "E03",
   "reason": "new",
   "psu": "0106",
   "stratum": "1"
  },
  {
   "hhid": "0106-005",
   "enumerator_id": "E07",
   "reason": "new",
   "psu": "0106",
   "stratum": "1"
  },
  {
   "hhid": "0106-006",
   "enumerator_id": "E02",
   "reason": "new",
   "psu": "0106",
   "stratum": "1"
  },
  {
   "hhid": "0106-007",
   "enumerator_id": "E01",
   "reason": "new",
   "psu": "0106",
   "stratum": "1"
  },
  {
   "hhid": "0106-008",
   "enumerator_id": "E01",
   "reason": "new",
   "psu": "0106",
   "stratum": "1"
  },
  {
   "hhid": "0106-009",
   "enumerator_id": "E02",
   "reason": "new",
   "psu": "0106",
   "stratum": "1"
  },
  {
   "hhid": "0107-001",
   "enumerator_id": "E01",
   "reason": "new",
   "psu": "0107",
   "stratum": "2",
   "replacements": [
    "0107-101"
   ]
  },
  {
   "hhid": "0107-002",
   "enumerator_id": "E01",
   "reason": "new",
   "psu": "0107",
   "stratum": "2",
   "replacements": [
    "0107-102"
   ]
  },
  {
   "hhid": "0107-003",
   "enumerator_id": "E03",
   "reason": "new",
   "psu": "0107",
   "stratum": "2",